{
  "schemaVersion": 1,
  "sequence": 6,
  "generatedAt": "2026-09-01T11:07:50.298Z",
  "expiresAt": "2026-10-01T11:07:50.298Z",
  "channels": [
    {
      "publisher": "EchoWorker",
      "id": "wechat",
      "name": "Echo WeChat",
      "summary": "WeChat channel for EchoAI with text and media support.",
      "releases": [
        {
          "version": "0.1.4",
          "status": "active",
          "artifacts": {
            "windows-x64": {
              "url": "https://github.com/EchoWorker/EchoChannelHub/releases/download/test-candidate/wechat-0.1.4-windows-x64.echochannel",
              "size": 35518275,
              "sha256": "a93d4f8b668968e644c4372722e54a713fe241ede4108fb503926b5f5b5b477a",
              "signature": "N/WzU8juv/xd1X3ja02AlguBphL9TM0yWvrkDEVH4SPDWj5e7cZe2+UKg0uXpMo2fa6RYpobgzRs75xh3aQOCQ==",
              "keyId": "echoworker-test-2026"
            }
          }
        }
      ]
    }
  ]
}
